{
 "contract": "config.v1",
 "service": "meeting-api",
 "keys": [
  {
   "key": "ADMIN_TOKEN",
   "class": "required-explicit",
   "secret": true,
   "description": "HS256-signs the per-spawn MeetingToken AND verifies the recordings upload — the same admin secret admin-api holds (ADMIN_API_TOKEN); unset, every POST /bots would 500, so the boot refuses instead (A4)"
  },
  {
   "key": "DB_HOST",
   "class": "defaulted",
   "default": "postgres",
   "description": "PostgreSQL host (the meeting/session/transcript store)"
  },
  {
   "key": "DB_PORT",
   "class": "defaulted",
   "default": "5432",
   "description": "PostgreSQL port"
  },
  {
   "key": "DB_NAME",
   "class": "defaulted",
   "default": "vexa",
   "description": "PostgreSQL database name"
  },
  {
   "key": "DB_USER",
   "class": "defaulted",
   "default": "postgres",
   "description": "PostgreSQL user"
  },
  {
   "key": "DB_PASSWORD",
   "class": "defaulted",
   "default": "postgres",
   "secret": true,
   "description": "PostgreSQL password (dev default; change for any non-local deploy)"
  },
  {
   "key": "DATABASE_URL",
   "class": "defaulted",
   "default": "(derived from DB_HOST/DB_PORT/DB_NAME/DB_USER/DB_PASSWORD as postgresql+asyncpg://)",
   "secret": true,
   "description": "explicit async SQLAlchemy URL override; when unset the URL is built from the DB_* parts (lite deliberately sets only DB_* so the asyncpg driver is chosen)",
   "targets": []
  },
  {
   "key": "DB_POOL_SIZE",
   "class": "defaulted",
   "default": "5",
   "description": "SQLAlchemy async-engine pool_size (persistent connections per pod) applied at every engine site via meeting_api.db.build_engine. Pure runtime override — reconcile with deploy/db-budget.json (Σ replicas × (pool_size + max_overflow) + reserved ≤ max_connections) on managed Postgres. #635.",
   "targets": []
  },
  {
   "key": "DB_MAX_OVERFLOW",
   "class": "defaulted",
   "default": "10",
   "description": "SQLAlchemy async-engine max_overflow (burst connections above pool_size per pod). Pure runtime override — reconcile with deploy/db-budget.json. #635.",
   "targets": []
  },
  {
   "key": "REDIS_URL",
   "class": "defaulted",
   "default": "redis://redis:6379/0",
   "description": "the transcription_segments stream + bm:meeting:{id}:status pub/sub + bot-command channel backing"
  },
  {
   "key": "RUNTIME_API_URL",
   "class": "defaulted",
   "default": "http://runtime:8090",
   "description": "the runtime kernel's runtime.v1 surface bot_spawn creates workloads on"
  },
  {
   "key": "MEETING_API_URL",
   "class": "defaulted",
   "default": "http://meeting-api:8080",
   "description": "this service's own base URL as the spawned bot must reach it (lifecycle.v1 callback + transcript socket); compose relies on the default service DNS name, helm sets it explicitly to the release-qualified Service DNS, lite overrides to localhost",
   "targets": [
    "lite"
   ]
  },
  {
   "key": "INTERNAL_API_SECRET",
   "class": "defaulted",
   "default": "(unset — the internal lifecycle-callback header is then not attached)",
   "secret": true,
   "description": "shared secret for internal service-to-service calls (x-internal-secret on the self-driven lifecycle callback)"
  },
  {
   "key": "DEFAULT_BOT_NAME",
   "class": "defaulted",
   "default": "(unset — request_bot falls back to VexaBot-{random})",
   "description": "server-side bot participant name used by POST /bots when bot_name is omitted"
  },
  {
   "key": "TRANSCRIPTION_SERVICE_URL",
   "class": "capability",
   "capability": "stt",
   "description": "STT base URL the spawned bot transcribes against (the client appends /v1/audio/transcriptions) — self-hosted deploy/transcription or a hosted vexa.ai token's endpoint"
  },
  {
   "key": "TRANSCRIPTION_SERVICE_TOKEN",
   "class": "capability",
   "capability": "stt",
   "secret": true,
   "description": "bearer token for the STT service (must match that unit's API_TOKEN)"
  },
  {
   "key": "TRANSCRIPTION_MODEL",
   "class": "defaulted",
   "default": "(unset — the whisper client sends whisper-1)",
   "description": "STT model id bot_spawn threads into the invocation (the OpenAI-compatible `model` form part) — required by backends that validate model ids (Groq, vLLM); ignored by the bundled deploy/transcription unit. Helm plumbing is a declared follow-up (deploy/helm/README.md) — use extraEnv there for now",
   "targets": [
    "compose",
    "lite"
   ]
  },
  {
   "key": "TRANSCRIBE_ENABLED",
   "class": "defaulted",
   "default": "true",
   "description": "deployment-level default for a spawn's transcribe_enabled when the request does not say — set false for a capture-only deployment with no STT",
   "targets": [
    "compose"
   ]
  },
  {
   "key": "VEXA_JITSI_HOSTS",
   "class": "defaulted",
   "default": "",
   "description": "Comma-separated additional Jitsi deployment hostnames (a self-hosted instance whose name carries neither 'jitsi' nor a 'meet' label, e.g. calls.example.org) recognized when parsing pasted meeting links AND calendar (ICS) links; meet.jit.si, *jitsi* hosts, and (for pasted links) meet-labelled hosts are always recognized — unset ⇒ no extra hosts",
   "targets": [
    "compose"
   ]
  },
  {
   "key": "RECORDING_ENABLED",
   "class": "defaulted",
   "default": "true",
   "description": "deployment-level default for a spawn's recording_enabled when the request does not say",
   "targets": [
    "compose"
   ]
  },
  {
   "key": "BOT_AUTHENTICATED",
   "class": "defaulted",
   "default": "false",
   "description": "deployment-scoped authenticated-bot knob: when true, EVERY POST /bots spawn carries the invocation.v1 auth block so the bot restores the provisioned browser session (make login) and joins signed-in. Demands the BOT_USERDATA_S3_PATH + BOT_S3_* keys — incomplete config answers a typed 503 (never a silent anonymous join).",
   "targets": [
    "compose",
    "helm"
   ]
  },
  {
   "key": "BOT_USERDATA_S3_PATH",
   "class": "defaulted",
   "default": "(unset — required when BOT_AUTHENTICATED=true; the userdata prefix holding the provisioned session, e.g. userdata/bot-identity-1)",
   "description": "stored-session prefix; also the per-identity serialization key (one live authenticated bot per prefix)",
   "targets": [
    "compose",
    "helm"
   ]
  },
  {
   "key": "BOT_S3_ENDPOINT",
   "class": "defaulted",
   "default": "(unset — required when BOT_AUTHENTICATED=true)",
   "description": "userdata store endpoint, as reachable FROM the bot containers (e.g. http://minio:9000)",
   "targets": [
    "compose",
    "helm"
   ]
  },
  {
   "key": "BOT_S3_BUCKET",
   "class": "defaulted",
   "default": "(unset — required when BOT_AUTHENTICATED=true)",
   "description": "userdata store bucket",
   "targets": [
    "compose",
    "helm"
   ]
  },
  {
   "key": "BOT_S3_ACCESS_KEY",
   "class": "defaulted",
   "default": "(unset)",
   "secret": true,
   "description": "SCOPED userdata-store access key — never the deployment's admin S3 credentials; rides the invocation env into the bot container, so its blast radius must be the userdata prefix only",
   "targets": [
    "compose",
    "helm"
   ]
  },
  {
   "key": "BOT_S3_SECRET_KEY",
   "class": "defaulted",
   "default": "(unset)",
   "secret": true,
   "description": "scoped userdata-store secret key (see BOT_S3_ACCESS_KEY)",
   "targets": [
    "compose",
    "helm"
   ]
  },
  {
   "key": "MINIO_ENDPOINT",
   "class": "defaulted",
   "default": "minio:9000",
   "description": "object-store host:port (or full http(s) URL) recordings are written to"
  },
  {
   "key": "MINIO_ACCESS_KEY",
   "class": "capability",
   "capability": "object_storage",
   "description": "object-store access key (recordings upload/finalize)"
  },
  {
   "key": "MINIO_SECRET_KEY",
   "class": "capability",
   "capability": "object_storage",
   "secret": true,
   "description": "object-store secret key"
  },
  {
   "key": "MINIO_BUCKET",
   "class": "defaulted",
   "default": "vexa",
   "description": "recordings bucket"
  },
  {
   "key": "MINIO_SECURE",
   "class": "defaulted",
   "default": "false",
   "description": "https toward the object store when true"
  },
  {
   "key": "S3_ENDPOINT",
   "class": "defaulted",
   "default": "(unset — falls back to MINIO_ENDPOINT/MINIO_SECURE)",
   "description": "explicit S3 endpoint override for a non-MinIO store",
   "targets": []
  },
  {
   "key": "S3_ACCESS_KEY",
   "class": "defaulted",
   "default": "(unset — falls back to MINIO_ACCESS_KEY)",
   "description": "explicit S3 access-key override",
   "targets": []
  },
  {
   "key": "S3_SECRET_KEY",
   "class": "defaulted",
   "default": "(unset — falls back to MINIO_SECRET_KEY)",
   "secret": true,
   "description": "explicit S3 secret-key override",
   "targets": []
  },
  {
   "key": "RECORDING_BUCKET",
   "class": "defaulted",
   "default": "recordings",
   "description": "recordings bucket for the standalone recordings composition (the unified app uses MINIO_BUCKET first)",
   "targets": []
  },
  {
   "key": "STORAGE_BACKEND",
   "class": "defaulted",
   "default": "minio",
   "description": "storage-backend label stamped into the recording's meeting.data JSONB",
   "targets": []
  },
  {
   "key": "MEETING_TOKEN_TTL_SECONDS",
   "class": "defaulted",
   "default": "18000",
   "description": "MeetingToken lifetime — must outlive the bot's max active time (default 4h) or transcription dies mid-meeting",
   "targets": []
  },
  {
   "key": "SEGMENT_CONSUMER_INTERVAL",
   "class": "defaulted",
   "default": "0.5",
   "description": "poll interval (s) of the transcription_segments stream consumer loop",
   "targets": []
  },
  {
   "key": "DB_WRITER_INTERVAL_S",
   "class": "defaulted",
   "default": "10",
   "description": "db-writer cadence (seconds) — each tick flushes immutable live segments from the redis hash meeting:{id}:segments into the transcriptions table and drains proc:meeting:{id} notes into meeting.data (the restored 0.10 flush loop)",